datatype	path	id	uiLabel	definition	minValue	maxValue	minLength	maxLength	pattern	help	preferred_unit
model	/	GENEPIO:0001657	geo_loc_name	Geographical origin of the sample; use the appropriate name from this list http://www.insdc.org/documents/country-qualifier-vocabulary. Use a colon to separate the country or ocean from more detailed information about the location, eg "Canada: Vancouver" or "Germany: halfway down Zugspitze, Alps"							
xmls:anyURI	/GENEPIO:0002091	NCIT:C25464	Country	A collective generic term that refers here to a wide variety of dependencies, areas of special sovereignty, uninhabited islands, and other entities in addition to the traditional countries or independent states.							
xmls:string	/GENEPIO:0002091/GENEPIO:0001657	GENEPIO:0001887	landmark								
xmls:anyURI	/GENEPIO:0002091/GENEPIO:0001657	NCIT:C80234	Municipality	A political unit, such as a city, town, or village, incorporated for local self-government.							
xmls:anyURI	/GENEPIO:0002091	ENVO:00000005	state / province / territory / region	A primary administrative division of a country, such as a state in the United States.							
xmls:string	/	GENEPIO:0000027	isolation_source	Describes the physical, environmental and/or local geographical source of the biological sample from which the sample was derived.							
xmls:anyURI	/	GENEPIO:0001567	host	The species of the host organism from which a specimen (pathogen) organism was obtained. Use the full taxonomic name, eg, "Homo sapiens".							
xmls:string	/	GENEPIO:0001724	host common name	The natural language (non-taxonomic) name of the type of organism (human or animal) that is the subject of a given investigation, study and/or specimen.							
xmls:anyURI	/	GENEPIO:0001617	host_disease	Name of disease in a subject that is related to a given investigation, study and/or specimen.							